{
  "id": "bbl.h2c",
  "vendor": "bambu",
  "name": "Bambu Lab H2C",
  "technology": "fff",
  "bed": {
    "shape": [
      [0, 0],
      [330, 0],
      [330, 320],
      [0, 320]
    ],
    "max_height": 325
  },
  "toolheads": {
    "count": 2,
    "kinematics": "corexy"
  },
  "nozzles": ["bbl.nozzle.0.4.standard", "bbl.nozzle.0.4.high_flow"],
  "settings": {
    "nozzle_diameter": {
      "0": 0.4,
      "1": 0.4
    },
    "extruder_variant_list": {
      "0": "Direct Drive Standard,Direct Drive High Flow,Direct Drive E3D High Flow",
      "1": "Direct Drive Standard,Direct Drive High Flow"
    },
    "printer_extruder_id": {
      "0": 1,
      "1": 1,
      "2": 1,
      "3": 2,
      "4": 2
    },
    "printer_extruder_variant": {
      "0": "Direct Drive Standard",
      "1": "Direct Drive High Flow",
      "2": "Direct Drive E3D High Flow",
      "3": "Direct Drive Standard",
      "4": "Direct Drive High Flow"
    },
    "nozzle_volume": {
      "0": 130,
      "1": 133,
      "2": 133,
      "3": 145,
      "4": 148
    },
    "retraction_length": {
      "0": 0.8,
      "1": 0.8,
      "2": 0.8,
      "3": 0.8,
      "4": 0.8
    },
    "hotend_heating_rate": {
      "0": 3.5,
      "1": 3.5,
      "2": 3.5,
      "3": 13.3,
      "4": 13.3
    }
  }
}
